filename,headline,alt_text,screen_represented,feature_verified,raw_screenshot_source
01_know_what_to_use_next.png,Know what to use next,Know what to use next screen for Fridge Finish showing today dashboard.,Today dashboard,Eat-soon dashboard,marketing/play-store/screenshots/raw/01_know_what_to_use_next.png
02_expiring_food_priority.png,See what expires soon,See what expires soon screen for Fridge Finish showing storage urgency list.,Storage urgency list,Urgency sorted food cards,marketing/play-store/screenshots/raw/02_expiring_food_priority.png
03_add_food_quickly.png,Add food in seconds,Add food in seconds screen for Fridge Finish showing food item form.,Food item form,Add/edit food item,marketing/play-store/screenshots/raw/03_add_food_quickly.png
04_fridge_freezer_pantry.png,Keep every food area organized,Keep every food area organized screen for Fridge Finish showing storage tabs.,Storage tabs,"Fridge, freezer, pantry, extra storage",marketing/play-store/screenshots/raw/04_fridge_freezer_pantry.png
05_reminders_before_expiry.png,Get reminded before food is wasted,Get reminded before food is wasted screen for Fridge Finish showing notification settings.,Notification settings,Local reminders,marketing/play-store/screenshots/raw/05_reminders_before_expiry.png
06_leftovers_and_food_tracking.png,Keep leftovers visible,Keep leftovers visible screen for Fridge Finish showing leftover rescue.,Leftover rescue,Leftover tracking and rescue recipes,marketing/play-store/screenshots/raw/06_leftovers_and_food_tracking.png
07_progress_or_insights.png,Turn groceries into meal ideas,Turn groceries into meal ideas screen for Fridge Finish showing recipes.,Recipes,Local recipe suggestions,marketing/play-store/screenshots/raw/07_progress_or_insights.png
08_simple_private_organized.png,Simple food tracking,Simple food tracking screen for Fridge Finish showing settings/privacy.,Settings/privacy,Local-first storage,marketing/play-store/screenshots/raw/08_simple_private_organized.png
